{
  "schema": "vibolearning/v1",
  "id": "c-lang",
  "name": "Язык C",
  "accent": "#A78BFA",
  "description": "Большой курс: от printf до указателей, структур и файлов",
  "author": "ViboLearning",
  "version": 1,
  "startingHearts": 5,
  "modules": [
    {
      "name": "Первая программа",
      "order": 1,
      "practice": true,
      "lessons": [
        {
          "name": "Hello, world",
          "order": 1,
          "xp": 10,
          "blocks": [
            {
              "type": "text",
              "text": "Программа на C начинает выполняться с функции **main**. `#include <stdio.h>` подключает библиотеку ввода-вывода, откуда берётся `printf`.",
              "code": "#include <stdio.h>\n\nint main(void) {\n    printf(\"Hello, world\\n\");\n    return 0;\n}"
            },
            {
              "type": "text",
              "text": "`printf` печатает текст. `\\n` внутри строки — перевод строки. `return 0;` в конце main означает «программа завершилась успешно».",
              "code": "printf(\"Строка 1\\n\");\nprintf(\"Строка 2\\n\");",
              "output": "Строка 1\nСтрока 2"
            },
            {
              "type": "code",
              "language": "c",
              "caption": "Запусти, потом поменяй текст в кавычках.",
              "code": "#include <stdio.h>\n\nint main(void) {\n    printf(\"Привет, C!\\n\");\n    return 0;\n}",
              "output": "Привет, C!"
            },
            {
              "type": "quiz",
              "variant": "single",
              "prompt": "С какой функции начинается выполнение программы на C?",
              "options": ["start", "printf", "main", "begin"],
              "answer": 2,
              "explanation": "Точка входа — всегда `main`."
            },
            {
              "type": "quiz",
              "variant": "type",
              "prompt": "Какая функция печатает текст на экран? Впиши пропущенное.",
              "code": "___(\"Hi\\n\");",
              "answer": ["printf"],
              "explanation": "`printf` — от print formatted."
            },
            {
              "type": "quiz",
              "variant": "single",
              "prompt": "Что делает `\\n` внутри строки?",
              "options": ["Печатает букву n", "Переводит строку", "Ставит пробел", "Завершает программу"],
              "answer": 1
            }
          ]
        },
        {
          "name": "printf подробнее",
          "order": 2,
          "xp": 12,
          "blocks": [
            {
              "type": "text",
              "text": "В одной строке `printf` можно совмещать текст и **спецсимволы**: `\\n` — новая строка, `\\t` — табуляция, `\\\\` — обратный слэш, `\\\"` — кавычка.",
              "code": "printf(\"a\\tb\\n\");\nprintf(\"путь: C:\\\\dir\\n\");",
              "output": "a\tb\nпуть: C:\\dir"
            },
            {
              "type": "text",
              "text": "Без `\\n` следующий `printf` продолжит ту же строку.",
              "code": "printf(\"раз \");\nprintf(\"два\\n\");",
              "output": "раз два"
            },
            {
              "type": "quiz",
              "variant": "single",
              "prompt": "Что выведет этот код?",
              "code": "printf(\"1\");\nprintf(\"2\");\nprintf(\"3\\n\");",
              "options": ["1\\n2\\n3", "123", "1 2 3", "ошибка"],
              "answer": 1,
              "explanation": "Перевод строки только один — в конце."
            },
            {
              "type": "quiz",
              "variant": "type",
              "prompt": "Какой спецсимвол делает табуляцию? Впиши.",
              "code": "printf(\"имя___фамилия\");",
              "answer": ["\\t"],
              "explanation": "`\\t` — горизонтальная табуляция."
            }
          ]
        },
        {
          "name": "Комментарии и структура",
          "order": 3,
          "xp": 10,
          "blocks": [
            {
              "type": "text",
              "text": "Комментарии игнорируются компилятором. `// ...` — до конца строки, `/* ... */` — блок из нескольких строк.",
              "code": "// это комментарий\nint x = 5;  // и это\n/* а это\n   многострочный */"
            },
            {
              "type": "text",
              "text": "Минимальная программа состоит из: подключения заголовков, функции `main`, тела в фигурных скобках и `return`.",
              "code": "#include <stdio.h>\n\nint main(void) {\n    // тело программы\n    return 0;\n}"
            },
            {
              "type": "quiz",
              "variant": "multiple",
              "prompt": "Что из этого — комментарии в C?",
              "options": ["// текст", "# текст", "/* текст */", "<!-- текст -->"],
              "answer": [0, 2]
            },
            {
              "type": "practice",
              "prompt": "Сопоставь элемент программы и его роль",
              "terms": [
                { "display": "#include <stdio.h>", "meaning": "Подключает функции ввода-вывода" },
                { "display": "int main(void)", "meaning": "Точка входа в программу" },
                { "display": "printf", "meaning": "Печатает текст на экран" },
                { "display": "return 0;", "meaning": "Успешное завершение программы" }
              ]
            }
          ]
        }
      ],
      "exam": {
        "title": "Контрольные: первая программа",
        "passScore": 3,
        "xp": 30,
        "questions": [
          {
            "variant": "single",
            "prompt": "Зачем нужна строка #include <stdio.h>?",
            "options": [
              "Запускает программу",
              "Подключает printf, scanf и другие функции ввода-вывода",
              "Создаёт переменную",
              "Это комментарий"
            ],
            "answer": 1
          },
          {
            "variant": "single",
            "prompt": "Что выведет printf(\"A\\nB\");?",
            "options": ["A\\nB одной строкой", "A и B на разных строках", "AB", "ошибка"],
            "answer": 1
          },
          {
            "variant": "type",
            "prompt": "Каким числом main сообщает об успешном завершении? Впиши пропущенное.",
            "code": "int main(void) {\n    return ___;\n}",
            "answer": ["0"]
          },
          {
            "variant": "multiple",
            "prompt": "Что верно про C?",
            "options": [
              "Выполнение начинается с main",
              "printf печатает текст",
              "// начинает многострочный комментарий",
              "Тело функции — в фигурных скобках"
            ],
            "answer": [0, 1, 3]
          },
          {
            "variant": "order",
            "prompt": "Расставь строки минимальной программы",
            "items": ["#include <stdio.h>", "int main(void) {", "    return 0;", "}"],
            "answer": [0, 1, 2, 3]
          }
        ]
      }
    },
    {
      "name": "Переменные и типы",
      "order": 2,
      "practice": true,
      "lessons": [
        {
          "name": "Объявление переменных",
          "order": 1,
          "xp": 12,
          "blocks": [
            {
              "type": "text",
              "text": "Переменная — именованная ячейка памяти. Формат: `тип имя = значение;`. В `printf` значение подставляется через **спецификатор** — для целых это `%d`.",
              "code": "int age = 18;\nprintf(\"возраст: %d\\n\", age);",
              "output": "возраст: 18"
            },
            {
              "type": "text",
              "text": "Значение можно менять присваиванием `=`. `const` перед типом запрещает изменение.",
              "code": "int x = 1;\nx = 42;\nconst int LIMIT = 100;  // LIMIT менять нельзя",
              "output": ""
            },
            {
              "type": "quiz",
              "variant": "type",
              "prompt": "Какой спецификатор printf для целого числа? Впиши.",
              "code": "printf(\"%___\", count);",
              "answer": ["d"],
              "explanation": "`%d` — decimal integer."
            },
            {
              "type": "quiz",
              "variant": "multiple",
              "prompt": "Какие объявления корректны?",
              "options": ["int count = 10;", "int 2x = 4;", "int total;", "int = 5;"],
              "answer": [0, 2],
              "explanation": "Имя не может начинаться с цифры и не может отсутствовать."
            }
          ]
        },
        {
          "name": "Числовые типы",
          "order": 2,
          "xp": 14,
          "blocks": [
            {
              "type": "text",
              "text": "`int` — целые, `float` и `double` — дробные (double точнее). Спецификатор для дробных — `%f`.",
              "code": "int n = 5;\ndouble pi = 3.14;\nprintf(\"%d %f\\n\", n, pi);",
              "output": "5 3.140000"
            },
            {
              "type": "text",
              "text": "`sizeof(тип)` возвращает размер типа в байтах. Обычно `int` — 4 байта.",
              "code": "printf(\"%d\\n\", (int)sizeof(int));\nprintf(\"%d\\n\", (int)sizeof(double));",
              "output": "4\n8"
            },
            {
              "type": "code",
              "language": "c",
              "caption": "Поиграй со значениями и спецификаторами.",
              "code": "#include <stdio.h>\n\nint main(void) {\n    double price = 9.99;\n    int qty = 3;\n    printf(\"итого: %.2f\\n\", price * qty);\n    return 0;\n}",
              "output": "итого: 29.97"
            },
            {
              "type": "quiz",
              "variant": "single",
              "prompt": "Какой тип выбрать для числа 3.14159?",
              "options": ["int", "char", "double", "void"],
              "answer": 2
            },
            {
              "type": "quiz",
              "variant": "single",
              "prompt": "Что напечатает printf(\"%.1f\", 2.0/3.0);?",
              "options": ["0", "0.7", "0.6", "0.67"],